text,negative
"Важно, чтобы к нам на исследование пришел тот человек, который подписывал соглашение о неразглашении. Если это будет не так, последствия для нас и для компании могут быть необратимы. Именно поэтому так важно сверять человека и его фотографию в документах. И делать это дотошно.В фотографировании на паспорт, как и на любой другой документ, есть несколько особенностей. Именно эти особенности иногда ставят нас в тупик, и мы спрашиваем себя: ""А это один и тот же человек? Точно?""",negative
"Скучненько переписало. Но всё же грамотно, поэтому тут только с панибратскоого в занудный можно было переделать, мне кажется.  Ну и однородные убрать, скобочки – это тоже понятно)",negative
вы слишком хороши.,positive
не могу покуситься на святое :),negative
"Это значит, что статью будет интересно читать людям того же профессионального уровня, которые её писали. — такое запутанное предложение, что я даже не могу сообразить, как распутать. Почему это определение экспертной статьи? Если копирайтер-новичок напишет статью про 10 инструментов для совместной работы, то ее тоже будет интересно читать людям того же профессионального уровня, «которые ее писали». Понимаю, что есть первая часть, но определение само по себе неверное.",negative
"Честно говоря, про биссектрису я бы вообще убрала. Потерявшись и запаниковав, никто про нее и не вспомнит.",negative
"Мнение важных для меня людей подходит любое, могу пофыркать, на остальных наплевать",negative
"долго думала, решила, что Тематический форум то тоже подойдет - там модеры ток так банят всех! Ну и они бывают закрытыми.",negative
У вас в статье рисунки неправильно сверстаны в пункте Давайте конкретизировать,negative
Не получилось воспроизвести аудиофайл,negative
"С велосипедистом не согласна. Он же именно объездил пол Европы, а не прилетел, покатался в центре города, улетел дальше. По идее ему важно ехать долго и чтобы велик не сломался.",negative
"я программист но тоже читаю статьи на яндекс маркете, что как выбрать, у меня MAC а если надо windows купить, то нужна информация о последних тенденциях",negative
"Клубнику если помыть то она ""раскиселивается"", поэтому придти домой и в холодильнике нормальную помытую клубнику нельзя, максимум водянистые ягоды уже",negative
"Вообще это не на текст, а на меню похоже. и рука не поднимается делать из меню текст :(",negative
"На вопрос ""Какой уровень обещают студенту, который пройдет курс?"" ответ дали в первом абзаце. Там написано до середины уровня B2.",negative
"явно сказано, что ПОЛОВИНА В2 (первый абзац)",negative
Про настолки мне кажется всё же текст обращается к читателю: если придёте к нам работать...,negative
"Про Нижний Новгород я бы вообще написала отдельно, а не в общей куче новостей.Жителям Нижнего -  о том, что Я.Лавка появилась в городе. Остальной аудитории - ""если вы поедете в Нижний Новгород - есть возможность пользоваться севисом.Инвесторам - что мы расширяемся)))",negative
Вот эти ваши задачи- просто пушка!,positive
Не работает(((,negative
"На мой взгляд, смысл примерно тот же.",negative
Тут что-то совсем плохо с подсчетом баллов :(,negative
хм... 0 баллов?!,negative
"На практике приходится ориентироваться на бизнес-задачу  (особенно внутреннему исполнителю). Она не обязательно обращена к внешнему клиенту и сильно завязана на налаженный в компании механизм продаж. По этому тексту видно, что заказчик внутри Яндекса, а не вне его, а предполагаемый участник опроса при любых обстоятельствах его пройдет. С таким ТЗ текст не так уж и плох, кнопка ""Пройти опрос"" нормально видна.",negative
"Я не согласна с ответами. Читателю полезна информация о том, когда состоится вебинар и какая будет тема. Вопрос в таком случае к формулировке. Чтобы говорить не о себе, можно сформулировать так: ""Приходите на вебинар 15 июля. Вы узнаете..."" И тогда вопрос - мы должны усвоить, что в целом плохо говорить о себе, как о компании? Или просто мы должны по-другому формулировать мысли? В любом случае, эта информация кажется полезной для пользователя. А вот ""Будет интересно"" больше похоже на восхваление себя. Нужно предоставить читателю информацию о вебинаре и дать ему самому решить, интересно будет или нет.",negative
"Не думаю, что первый абзац про читателя. Здесь компания просто хвалится своими возможностями. Второй абзца как-то ""ближе к телу""",negative
"В первом абзаце первое предложение дает искажение о том, что речь обо мне. Авторы заявляют, что у меня самый быстрый интернет. А дальше рассказывают про себя, пытаются обосновать свои слова. Они, разве замеряли мою среднюю скорость несколько раз? Тогда бы фраза была про то, что "" мы замеряли вашу среднюю скорость последние полгода, и вы уникальный товарищ даже среди наших абонентов"".  А по факту, они взяли какую то выборку ( какую? ) и сравнили её каким то образом (каким?) со средней скоростью других абонентов ( какая там выборка?). То есть я скорей всего не попадал в эту выборку, и не факт что у меня самый быстрый интернет. Это не только рассказ не про меня, так еще и маркетинговое вранье.  В третьем абзаце добавляют ссылку, для таких зануд как я, которые хотят проверить факты из первого абзаца. Первый абзац не обо мне, и третьий тоже.",negative
"меня, как пользователя вообще не интересует, быстрей или нет у меня интернет, чем у кого-то там. а вот что я могу или не могу сделать со своим интернетом - это прям моё всё",negative
"Хохочу, какие же вы крутые с этой задачкой:)",positive
"Текст уже во все ячейки пишу, а всё равно не учитывается(((",negative
"Возможно, туплю. Но не нашел к чему придраться и удалить.",negative
"Мне наоборот показалось, что поздравлять с новым начинаем здесь излишне, а вот напомнить о постоянстве в своих занятих – уместно и как-то мотивирует.",negative
"Кажется, последний абзац тоже не несетважной смысловой нагрузки.",negative
"Признаться, не поняла, почему не нужно писать про акцию.",negative
"Если вопрос стоит так, какие абзацы, а не предложения нужно удалить, то второй абзац я бы не стала удалять. В нем есть важная информация о сроках акции.",negative
"Что может быть более интересное, чем новые заказчики? В этом предложении нет сути, по-моему его тоже стоит удалить.",negative
нуужна в подсказке - точно так задумано? ),negative
"Как проклятый – устойчивое сочетание,как дизайнер –",negative
"Ну не нужна же запятая в первом случае!! Хотя может вы и правы, с корректором то надо дружить... Но я всё равно не согласна. :)",negative
"Вы уверены, что в последнем не нужно обособление оборота? Там же, вроде, оттенок причины в значении.",negative
"У вас во втором задании ""сдаюсь, доверюсь коррктору"", но я знаю, что там нужно только одна запятая, перед ""как проклятому"".",negative
"""Вашей чутье"" - несогласованность в предложении в задании",negative
Самое сложное задание(,positive
Тупой яндекс! я написала Недоварено но он сказал что это не верно),negative
"Спасибо, не знала о репетиторе!",positive
"что-то второй разбор совсем ничего не прояснил... ещё подумав: юзабилити - дно((кто с ЕГЭ не сталкивался и не натаскивал именно решение этих тестов - хрен его сдаст(в задании: ""Определите предложение, в котором оба выделенных слова пишутся слитно.""пишу предложение, без пробелов, как просили:ИпреждеАндрейничегоТОЖЕнеощущал,ЗАТОбылсчастливиспокоен.а оказывается, надо не предложение, а только слова: тожезато или затотоже",negative
"возможно, лучше написать ""в порядке убывания авторитетности"", ведь может быть ещё ""в порядке возрастания авторитетности""",negative
"пришлось точками ""....""  ""добивать"" количество знаков, чтобы получить максимальный балл.",negative
"1. Логически не очень понятно: сначала пройти курс, написать отзыв, а потом тебе вернуть 50% стоимости на карту. Или авансом дадут скидку 50%?2. Гугл и Яндекс — разве ресурсы?",negative
"Классно, я отметил для себя что надо разбивать текст на предложения и так легче анализировать",positive
"Непонятен механизм выставления баллов в этом задании. За баллами не гонюсь, просто интересно :)",negative
"Баллы мне снизили, а меж тем, на мой взгляд, предложение ""1. ранее пройти любой..."" - лишнее. И без него тексту легче.",negative
"Вопрос про ""Так нормально получилось?"". По идее ведь редактор и говорит, что нормально, а что нет? Кого он спрашивает, нормально ли?",negative
"Не поняла, почему редактор может оставить коммент ""так нормально получилось""? Это то есть он переписал часть текста?",negative
Почему первый вариант не может быть комментарием редактора?,negative
"Вместо ""Вот спасибо!"" к последнему у меня есть много разных слов. Правда ""Спасибо"" среди них нет)))",negative
Хочу благодарить UX-писателя огромным спасибо и буду >.<,negative
"Возможно моя жизнь скучна, но мне трудно представить себе человека, использующего такое количество оттенков благодарности...",negative
"Последний вариант. Благодарить в таком случае просто глупо. Достаточно дать понять, что позицию автора понял и искать нового. Возможно, это прозвучит жестко, но незачем тратить время и эмоции на людей, которые нарушают договоренности.Ну и варианты ответов очень субъективные. Все зависит от принятого стиля общения с тем или иным сотрудником и стилем общения в самой компании.",negative
"слово ""лайвхак"" в письме не упоминалось, поэтому ""пользуйтесь нашим лайфхаком"" вызывает панику из серии ""аааа, я что-то в спешке пропустил!"", но потом при перечитывании ничего не находится и начинается неуверенная угадайка ""наверно, они имели ввиду этот пункт..."" не комфортно.",negative
"Если это сложная система, причем настолько, что возникла проблема с нагрузкой техподдержки, в хэлп будут заглядывать часто. Поэтому к его созданию и редактированию нужно подойти ответственно — не забивать на редактуру и корректуру, на вычитку экспертами, на правки. А раз задача не срочная, то и итераций мы можем позволить себе несколько. Поэтому с некоторыми вашими вариантами я не согласна.",negative
"Думаю, если планируются инструкции по системе, то лучше их готовить в паре с дизайнером. Потому что он может продублировать или даже заменить часть текста с помощью пометок на самих картинках. Например, он может подготовить скриншот интерфейса, нарисовать поверх стрелку и написать, что такая-то кнопка делает то-то и то-то. Конечно, дизайнер может это сделать и после получения готового текста, но именно автор текста может подсказать, на что на схеме сделать основной упор.",negative
"мне кажется задача ""хотим снизить нагрузку на тех.поддержку"" слишком общая, и ее можно добиться разными способами. Да еще и придется измерять как то эффективность этих способов. И способы могут быть разными, к примеру можно, написать что то такое, после чего клиент перестанет пользоваться продуктом, формально задача "" снизить нагрузку на тех. поддержку"" будет выполнена. Можно так дооптимизироваться, что у всех нагрузка пропадет",negative
"Даже если нужно срочно, нельзя забивать на вычитку и проверку верстки — а вдруг копирайтер забудет какую-нибудь важную деталь? поэтому с двумя вариантами я не согласна",negative
"Корректура сейчас нужна практически всегда - везде очень много ошибок, особенно грамматических. Плюс учитывать важность этого параметра для аудитории. Для отдельных форматов можно не заморачиваться. По условиям этой задачи, потенциальные участники вебинара могут быть чувствительны к этому вопросу (неграмотный текст - неграмотный специалист).",negative
"В этой задачке так много «но». Если автор, дизайнер и корректор сидят за соседним столом, а письмо и посты маленькие, то почему бы все-таки не показать?",negative
"А чем плохо описание цели текста про железки? Нам ж нужна новая аудитория и т п. Может мы вообще честно скажем, что недавно на рынке. Мы тоже не можем съесть собаку еще на этом,а зацепить новых людей и подводить к целевому действию - это хорошо..",negative
"""на обслуживании малых производств собаку съела"" - это ли не враньё, от которого вы так открещивались в первых уроках? неизбежные ошибки роста клиент простит новичку, понимая, на что идет, но от тех же ошибок понтовой компании - его будет бомбить в соц. сетях.",negative
"В последнем ни один из вариантов. Я считаю, что не каждому человеку хватит ума и желания понять, что вы хотите донести, и еще и использоваться потом это в деле. Но очень уж высокопарно это написано.",negative
"Изначально я написала от имени себя как человека и ученика), а не от себя, как ""себя как работника моей компании""... Это не совпадет с выборами первого столбца предыдущего задания.Судя по баллам - нужно было не так)",negative
"А я бы говорила так, как выбрала",negative
"Вариант ""надеемся, задачи не оказались для вас слишком сложными"" подразумевает, что я недостаточно умная для них. Поэтому первый вариант предпочтительнее",negative
"Не поняла, почему неправильными считаются ответы на вопросы, в которых спрашивают моё мнение)) Про слоган и поговорку",negative
Баллы почему-то не считаются :(,negative
"Очень интересная механика, но очень-очень спорная. Жаль, нет времени и места для дискуссии. Один пример: ""лучше было написать"" - так, как вы написали, а как бы у меня получилось ""своим голосом"" - это совсем другой вопрос, я считаю, что моим голосом - получилось бы хуже, ваш голос - вам больше подходит)). Ну и раз ""я - доступный для всех"" - значит курс доступный?.. Слишком далеко идущие выводы. Но интересный опыт для подумать на тему: ""ты не то, что о себе думаешь и дажа мечтая - представляешь не то, что реально мог бы создать""",negative
"По исходному тексту я не поняла, кто на ком стоял)) Поэтому объясню: считаю, что в тексте нужно честно признать изменение условий обслуживания. Не ругать конкурентов, не извиняться, не врать. Объяснить причины изменения. Убрать смайлики и все такое.",negative
"Это же ситуативный маркетинг, хоть и неудачный. Аналогичный пост про Сбербанк и СБП, кажется, вызвал восторг публики. Они попытались повторить успех, вышло не очень. Но ухудшение условий у Тинькофф меня правда здорово разозлило. Нельзя применять к SMM правила UX-копирайтинга. Если убрать из поста пинание конкурентов, то пост теряет всю свою соль и направленность на обиженных клиентов Тинькофф и превращается в обычный рекламный текст. Скучно. Я бы оставила пинание конкурентов, но так, чтобы самим не подставляться. Другое дело, что с потерей денег и заявлением ""но мы-то не такие"", они перегнули.",negative
"Слушайте, а можно не просто писать ""поменяйте текст"", а объяснять с какой-целью его надо поменять? Ничего не понятно, можно как-то конкретно задания формулировать)",negative
Второй абзац в принципе написан хорошо. Максимально информативно и по делу. Поэтому взял его и почти без изменений вставил в свой вариант. Убрал капс.,negative
