text,negative
"А тут я исхожу из предположения, что мероприятие хотя и ежегодное, но для выпускников — поэтому аудитория будет в основном новая. А поскольку это официальный сайт, на котором мы должны дать информацию (что, кто, где, когда) — то облажаться страшно и непростительно, нельзя вводить людей в заблуждение. И почему они хотят повод для высказываний, если заходят на информационный сайт за информацией о мероприятии?",negative
почему аудитория не новая? выпускники же каждый год разные И еще про пищу для размышлений не поняла. Они что не заинтересованы в работе?,negative
"По четвертому пункту то же мнение, что и в предыдущем задании.",negative
"Не поняла, почему не оценят скрытые цитаты. Они же заканчивают универ, наверняка много читали разного.",negative
"Ярмарка для выпускников, а они знают о нас?! Да они вчера по клубам скакали и ни о чём не парились! Не сходится!",negative
"Зачем им высказываться, если они зашли на сайт, чтобы найти работу?",negative
"Что-то я не уверена на счёт цитат. Люди в таких конторах забитые, им не до этого. Поработала в похожих, но могу, конечно, ошибаться!",negative
"""Новая аудитория"", но уже ""Знают нас""? Как так?""Читают от и до""? Мне странно. Описание принципов человеко-машинного взаимодействия интересно разработчикам рабочего места машиниста. А в Воронеже инженеры сопровождают то, что им прислали сверху. Хотя если там экспериментальный завод по созданию новых поездов - тогда да)",negative
"Возможно, мной движут предрассудки, но я считаю, что для такого доклада инженеры — неподготовленная аудитория. Поэтому непонятно, почему они нас знают (судя по вашим правильным ответам). Дальше, если они пришли на конференцию, я надеюсь, что им нужна пища для размышлений, а не повод поболтать в курилке. А поскольку тема новая, и наткнется на неизбежный скепсис (особенно от тех, кто и так знаком с эргономикой), главную мысль надо будет повторять все время. Перегружать же кого угодно сложноподчиненными предложениями на презентации — это свинство. А то, что они инженеры, не гарантирует, что они могут и хотят вникать в непрофильные тексты.",negative
"Не согласен со вторым и четвертым пунктами. Если бы я работал в центральном офисе и выезжал на встречу с инженерами в первый раз, то, скорее всего, инженеры из Воронежа про меня и мою команду почти ничего не слышали. Даже у интеллектуальной аудитории, которой являются инженеры, найдутся и те, которые хотят изучить материал и попробовать применить его в своей работе, и те, кто уже сформировал свое мнение еще до начала моего выступления и уже готов его высказать.",negative
"Я не поняла, почему им нужен повод для высказывания. Разве лекция не для того, чтобы они потом какие-то действия предприняли или поразмышляли?Не поняла, как узнать: оценят скрытые цитаты или нет.",negative
"Тоже инженеры-железнодорожники кажутся образованными людьми, но технарями. Поэтому момент с высказываниями в курилке и цитатами спорный.",negative
"ну нет, не верю... видя копеешные зарплаты и дикую текучку на МОЭК, видя, кому удается ""зацепиться"", а кто плюёт и уходит, не верю, что в РЖД сильно лучше",negative
"Здесь скорее всего не хватает вводных. Если человек едит первый раз, то у него не может быть кредита доверия (он первый раз, и , несмотря на то, что он представитель центрального аппарата, этого может не хватить). Если эта аудитория - зануды, то скорее у них должен быть вариант, как для курилки, так и вариант для далнешейго осмысления ( и второй для такой аудитории может быть важнее).",negative
Когда просишь показатьнесовпадения - белая/синяя палитра не алё.ИМХО зеленое/красное внятней,negative
"Мм... Я нажала ""покажите, где ответы совпали с вашими"". Половина посерела половина посинела. А... А какие совпали-то?",negative
"Уточнение «ваша первая командировка» сбивает аж в двух местах. Получается, что по вашей логике это новая аудитория для выступающего, но знакомая компания для слушателей. Про второе можно догадаться, но первое понять без подсказки почти невозможно. Не хватает местоимения. Почти никому не достаточно четко сказать один раз)",negative
Так подать или пРодать чёртову ручку?,negative
"Подсказка с совпадением вариантов тут неправильно работает. Мне показала, что в в.1 ответ Б с моим не совпал с вашим правильным.  А в результате, он защитался как правильный. Если только это не уловка :-)",negative
"Первый вопрос какая-то прям ловушка, начинаешь читать рекламу в виде стишат, и мгновенно думаешь - ой, нельзя ли нормально, что за скидка, сколько и на что, что это за дурацкая прелюдия. И я вот упустила упоминание семи процентов скидки, потому что читала по-диагонали, аналитический ум искал аналитический текст.А потом пробуешь озвучить этот текст и понимаешь, что в нем и Суть, и цепляющая внимание рифма, действующая на запоминание. Но все равно - буэ) Хотя вы старались.",negative
"Я бы добавил в список пустой вариант по дефолту. Тк сейчас прослеживается паттерн, что нужно выбрать противоположный вариант.",negative
"Не согласен с ответом в первом задании. Да, там упоминается о том, что скидка в семь процентов. Но легко отвлечься во время прослушивания целого четверостишия. В итоге будут запоминаться только ""Супер скидки"".",negative
"Не согласна, что в вопросе ""Что полезней покупателю"" ответ про скидки в стихотворной игривой форме корректен (судя по тому, как сработали подсказки). Мне как покупателю полезнее кратко и по делу. Без игровых отступлений, в которые еще нужно вслушаться/вчитаться, распознать полезное знание и усвоить.",negative
"Офигенное задание! Прям показывает, насколько мозг привык к тому, что надо легко и просто, а на самом деле даже стишок может быть полезнее, чем обычный текст.",positive
"В первом вопросе первый текст также кажется полезным, потому что суть вынесена вперед. Во втором покупателю слишком долго нужно добираться до нужной ему информации.",negative
"Вам не кажется, что в 3 задании оба текста несут одну и ту же мысль? Херачили-херачили, но больше не заработали. А первый текст при этом читать проще, имхо.",negative
"Вот уж задачка...Нет, держусь и не буду делиться ссылками на фейсбук-аккаунты авторов курса.И так непросто выдергивать из контекста лаконичные отдельные фразы...Очень хотелось бы видеть, кого крутого посоветовали почитать другие участники курса.",positive
"Непонятно, почему 0 и точно ли определились цитаты, в нужное ли место я их вставила.",negative
"Чутье не подводит, спасибо, что без эпитета ""вкусный"" (набившего аскомину, хах). Здесь должна быть ссылка на Нору Галь:)",positive
Не хватает примеров как исправить мертвые фразы,negative
"Не понял, что живого во фразе ""Если все сосредоточатся"". Если долго мучится, что-нибудь получится — такое же клише, как благодарю за обратную связь.",negative
"Странное задание. Если в списке есть несколько людей, за которыми я не слежу. Как в таком случае я могу понять какая цитата к ним относится. В чем цель этого задания, выучить цитаты великих?",negative
"Странное какое-то задание. Зачем мне угадывать авторов всех этих высказываний? Я их нагуглила, конечно, но смысл задания не поняла :)",negative
Ссылка на vk.ru - это какой-то юмор?),negative
"Не смотрю интервью бизнесменов ""про жизнь"". Считаю, что там про себя и про бизнес слишком мало, чтобы смотреть (а расшифровывать в текст по каким-то причинам это обычно никому не надо). Но обращу внимание.",negative
Подсказка не отобразилась.,negative
"похоже, тут подсказка отвалилась, не выводится. или её и не было, тогда галочка - лишняя)",negative
"Гы. Тут не хватает цитаты из высказываний БГ и меня. :-)Это упражнение - скорей иллюстрация того, что неважно, кто сказал; главное - что мысль передана верно, я правильно понял?И вот для таких, не всегда очевидных результатов, предлагаю там, где написано ""Вы набрали..."", помимо баллов,втыкать простенькую формулу, сообщающую ПОЧЕМУ так вышло. Часть вопросов отпадёт.",positive
вообще не поняла почему стилистически эти 3 примера должны отличаться.,negative
"Интересно, по какому критерию была выставлена оценка 40 из 60?",negative
"Ну, тут можно поспорить. Сейчас все-таки начали писать объявления человеческим языком и на этом фоне ""будьте любезны"" и ""электротранспорт"" уже больше похоже на шутку или легкий сарказм и скорее это напишут в креативном кластере, а не ""очень вас просим""",negative
Какая прелесть),positive
"Я понимаю, что есть коллеги, который так общаются, но первый вариант мне ужасно неприятен. А его пришлось выбрать, потому что из контекста понятно, что другие варианты заняты. Если ""в жопу засуну"", то это не начальник, а хамло. А если начальник, то пусть бы он как-то поработал над способами выражения фрустрации!",negative
"Смешная задачка, но я бы не стала писать коллеге про жопу и весьма удивилась бы, если бы мне так написал начальник, хоть у нас и тоже вполне себе неформальное общение в коллективе.",negative
"Заломали меня. Я с Мишей такими словами не говорю ((( Но выбрала, раз уж вариантов не нашлось. Кстати, кажется будет веселее выбирать если в вариантах ответов будет больше чем вопросов. Пока кажется что достаточно как кубики распередлить выпадашки по одну разу без повторений. Но кто вас, коварных :-) , знает - может пока не видела задания с таким выбором.",negative
"""не оставляйте транспорт"" не согласуется с ""переместить их""",negative
"Несогласованность у вас в ответе, обозначенном правильным : ""не оставляйте ЭЕЛЕКТРОТРАНСПОРТ""... ""мы будем вынуждены переместить ИХ"". Ну и понятие электротранспорт - кажется попроще для понимания людям из креативного кластера, может, оно предназначалось для третьего варианта записки? А посетителем отелей - проще понять перечисление.",negative
"Я не буду писать своему коллеге, тем более подчиненному, таким слогом. Даже неформально, все можно сделать вежливее.",negative
"Если бы коллега написал мне такое письмо, я бы разозлилась",negative
Письмо к коллеге — огонь! Прям проорала),positive
Что такое ЧПХ? :-))),negative
мем про Наташу повеселил:),positive
про хабр смешно,positive
"не очевиден контекст в второй задачке. прежположил, что пишет коллега и у его потребность сделать всё как можно скорее забив на результат.",negative
"В третьей задаче я предположила, что презентацию о мероприятии посылают для того, чтобы человек это мероприятие посетил.",negative
Неудобно форматировать текст в экселевских ячейках (,negative
"В жизни бы не стала писать по таким ТЗ) Не понятно кому, куда и для чего это пишется. Во втором представила, что пишу директору после созвона с клиентом",negative
Очень сложно выбирать без контекста. Чую подставу :-),negative
"Нечего себе! 50 из 50 с первого раза. Я, видимо, умный.",positive
В третьем пункте ошибка или нет?,negative
"А почему Как выбрать справочный ресурс это не обращение к читателю? Если пункты Как выбрать, Как переименовать - обращения?",negative
"""Как выбрать справочный ресурс"" - по логике, тоже должна стоять галка. Поскольку это тоже действие пользователя.",negative
"""Что такое короновирус и как он передается"" - это не обращение к читателю. Галочка не нужна.",negative
"Начиная со слов ""Жителям Санкт-Петербурга"" - это подсказка, с какого места исправлять, или условие ""Оставить формулировку ""Жителям""?",negative
"Сначала подумала, что абзац должен начинаться со слов «Жителям Санкт-Петербурга», только после разбора поняла, что это не так",negative
"Облезлый Петербург как в ""Брате"" - запятая перед как",negative
"Если формально выполнять задание — отвечать на вопрос, где автор обращается к читателю, — ваши ответы будут верными. Но если говорить «что читателю будет интересно прочесть», то первый текст — это весьма интересная история, за которой хочется следить. А вот «Я нахожу полезное там...» — напротив, самолюбование, которое не слишком приятно читать даже в постах у друзей",negative
"Предпоследнее: ""я бы хотел сказать"" - это обращение.",negative
"Смущает запятая в ""Не то, чтобы""",negative
"Представимся вам vs. Познакомимся с вами  - спорная оппозиция. Когда мы представляемся вам, это мы прикладываем усилия, чтобы вам было удобнее. Вы просто сидите, а мы попляшем для вас. А вот Познакомимся с вами - это лично мне звучит как ""ну, мы еще на вас посмотрим"".  Дело субъективного восприятия языка.",negative
"Очень лень переписывать текст, если ты в нем уверен. Добавили бы галочку ""Согласен с первоначальным вариантом"".",negative
Хотелось бы тут напоминание написать еще короче,negative
"Сами по себе фразы на удаление, которые вы выбрали, пустые, конечно. Непонятно, как удалять: по принципу их пустоты или так, чтобы оставшйся текст сохранил связность?",negative
"В логике повествования, скомканном финале тоже редактор виноват.",negative
"Аааа! Всё же хоршо, что у меня не было ЕГЭ! ""тожезато"" - это machine reading, я понимаю. А выглядит как неологизм. Интересно, куда в нем ударение приходится? Я почему-то на предпоследний слог поставила - ""тожезАто""))) теперь сижу и рыдаю от хохота.",positive
Мало! :),positive
"Слишком много символов для засчитывания правильного ответа. если не написать академию наук, то получишь о баллов)",negative
"А чем это мне словарь «Слитно? Раздельно? Через дефис?» не будет полезен? Можно, конечно, и большой орфографический, но он все равно уже есть в грамоте. А с дефисами постоянно проблемы и вопросы",negative
"А чем плохо? Я же корректор, мне надо. Тут и орфография и падежные формы. А то такого понапишут. Управление, падежные окончания - самая проблема.",negative
"Про статью вообще не поняла - этим способом кто-то пользуется??Знакомая с двумя дипломами филфака пишет еще менее грамотно, чем я:(Про ""Орфограммку"" узнала впервые (у меня в работе только ""Grammarly"") - спасибо за наводку.",negative
"Ни фига - грамота.ру в ошибках не замечена. И Дитмар Эльяшевич тоже! А дипломы филфака, например, по техническим средствам обучения в южно-славянских языках ни о чем не говорят.",negative
"А вот уверена, что ответы неправильные. Я постоянно сомневаюсь в том, правильно ли написала, и, прежде всего, обращаюсь к грамоте, потому что там понятное объяснение Розенталя. К Розенталю в первую очередь вообще нельзя обращаться, потому что он нечитабельный. И вообще этот вопрос был субъективным: в подсказке спрашивают, на что надежнее ссылаться, когда спрашивают? Я знаю, что в большинстве случаев на Грамоту надежнее, потому и ссылаюсь. То есть надежность - вещь субъективная.",negative
"Оставить после курса - после какого курса? Логично предположить, что если хотите скидку на курс №2 - оставьте отзыв на курс №1 (который уже пройден). В разборе этой задачи почему-то предлагается сделать наоборот...В Google понятно, где отзывы оставлять - в выдаче в первом результате есть раздел ""Отзывы"". А в Яндексе непонятно...",negative
