text,negative
"Комментарии немного не сходятся с содержанием рассылки ценностно, на мой взгляд. Задача, к сожалению, не поставлена четко. Не понятно, для кого это мы пишем. Предложенный вами в ответах вариант тоже не универсален, тоже четко таргетирован на определенную группу и плохо работает вне ее.",negative
"в части ""банк предлагает мне поиграть с деньгами"", кажется, копирайтер все-таки не виноват, что банк придумал такую дурацкую геймификацию. Если такие условия участия в квесте, то с этим ничего не поделать.",negative
"См. коммент к задаче 31. Этот текст хорошо заходит моему ребенку 15 лет. Очевидно, что где-то близко и та аудитория, на которую нацелился банк. Возмущения не понимаю, поживите еще чуть-чуть и увидите, что вы никому не интересны, если только не накопили/наработали/еще что-нибудь на..., чтобы обслуживаться по классу ВИП.",negative
"Мне кажется, что Альфа обращается к определенной целевой аудитории. Задетые чувства (как в подсказке) - очевидное непопадание в ЦА. Они сейчас очень узкие и не такие универсальные, как раньше.",negative
"текст анонса выглядит так, как будто он предназначен для рассылки пользователям, которые вообще не используют карту для расчетов, а сразу выводят все деньги в другой банк - и в этом случае пользователь наверняка считает из сообщения не ""ты мало зарабатываешь"", а ""трать через нас, это тоже выгодно""",negative
Вы тролли! Измучали совсем.,positive
"смешно, но нет.",negative
Здорово!,positive
Очень очень очень очень крутое задание! Прям про жизнь. Пожалуй лучшее за два с четвертью курса.,positive
"В третьем варианте не согласна с вашим ответом. Менеджеру скорее всего придется пояснить, что именно и на сколько плохо. И если плохо всё — почему мы об это не говорили раньше.",negative
"В 3 пункте (про тексты всех ошибок и подсказок) любой ответ помечается как неверный. Выбрала тот, который считаю правильным.",negative
"вот щас было неочевидно, что нужно обязательно указывать свой вариант.",negative
"Не совсем поняла: в 3-м вопросе, получается, нет правильного ответа? Все ответы подсвечивает как неправильные",negative
"лишние слова в описании под ""Аргументы и факты"": надо самому приходится искать :)В третьем задании про ошибки и подсказки нет правильного ответа...",negative
"В 3 варианте — про инвентаризацию ошибок — не показывается правильный вариант, попробовала каждый, но почему-то не работает",negative
"""Если пользователи не разберуться, то они или забьют на наш продукт, или загрузят техподдержку вопросами.""тся же?",negative
"В третьем вопросе все ответы неправильные и баллы за него не начисляются. Проверьте, пожалуйста, и доначислите баллов.",negative
"В задании наверно ""надо"" лишнее? ""надо самому приходится искать задачи""",negative
"В описании: ""надо самому приходится""""Проинвентаризировать тексты ошибок..."" - нет правильного ответа?",negative
"""надо самому приходится"" - надо поправить текст задачи)!! ни один из вариантов ответа на третий вопрос система не признаёт правильным",negative
"""Что делать, если я не понимаю, чего от меня хотят"" — в реальной жизни есть куча интерфейсов, где уже на начальном этапе не понятно, что от тебя хотят. Пример — нужно внести показания счетчика, но для этого сначала нужно зарегистрироваться на сайте. В форме регистрации есть поле ""Reference ID"", а ты не знаешь что это такое. Конечная цель — оплатить воду, следовательно регистрация является лишь началом пользовательского сценария. Аналогичная ситуация с ""где мне взять информацию"" и ""что я могу сделать""",negative
"В описании задачи, наверное, надо заменить слово — не «другие модули заказчика», а «другие модули задачника», не?",negative
"Наверно опечатка в задании? Имелось в виду ""другие модули задачника""?",negative
"Ожидание можно использовать куда продуктивнее, нежели просто шутки шутить. В тех же играх сейчас частво встречается паттерн обучения во время загрузки, что позитивно сказывается на опыте игрока. В случае, когда документы отправлены на проверку, и эта проверка очень серьезная, я (как пользователь) врядли оценю юмор",negative
в корзине пусто - может человек пока не может ничего купить - денег нет! а вы тут шутите) шучу)) но подумал что этот момент иногда может быть,negative
"Кажется, что в логине-регистрации и в сообщениях об ошибках шутейки не очень уместны -- условно, в первом случае конверсию не увеличит, а во втором всяко не добавит ясности",negative
"Страница 404 – это частный случай ошибки, и шутка здесь также может вызывать раздражение. Видел подборки вариантов этой страницы, часть из них действительно смешные и креативные. Но в тот момент, когда я ищу информацию, перехожу по ссылке, а она не работает, мне как-то не до шуток.Ожидание – тут тоже все субъективно и зависит от контекста и скорости выполнения операции. Если приходится ждать очень долго, то шутка, особенно про чуть-чуть подождать, выглядит издевательством.",negative
"А как же написать в плейсхолдере email кого-нить из Звёздных войн? А какая-нибудь смешная кнопка, например, как у Яндекс. Драйва?",negative
"Сомневаюсь про страницу успеха, там пользователь весь в напряжении и ждёт, что оплата прошла, а ему шутка в лицо.",negative
"Страница 404 - это то же сообщение об ошибке, почему в нем шутить можно, а в ошибках нельзя?",negative
"Сверила ответы с вашими — Вопрос с Фигмой и Фотошопом не понятный. Тексты имеется в виду в интерфейсах самих программ или в макетах, которые там делаются? Если в самих программах — то не понятно, как они там могут быть объясняющими и разжевывающими, они тогда займут все рабочее пространство. Про врача тоже не понятно, какие тексты имеются в виду. Что касается — историй болезни и спорных случаев у пациентов, там важна исчерпывающая информация. Что касается интерфесных текстов — там точно важно не отсвечивать, а быть простыми и предельно понятными, без шуточек и всех этих юзер-френдли штучек. Как раз у медиков все хорошо с терминами и интерфейсы для них, скорее всего, проще остальных делать краткими, лаконичными и понятными.",negative
"С инфой для врачей не очень поняла. Им как раз надо текст, который даст максимум информации, это же важно..",negative
Про главврача было неожиданно,negative
"Не согласен с вариантом для главврача. Допустим в интерфейсе системы есть выпадающий список с вариантами. Интерфейсный элемент? Определенно. Разве не должен каждый из вариантов давать исчерпывающую информацию о себе? Можно возразить, что Главврач должен быть опытным и все понимать. Ну а если главврача только назначили, и он вообще не особо знает как этой системой пользоваться?",negative
"Сначала был не согласен с вариантом по поводу фигмы, затем вспомнил, как там организована информация, и что для обывателя она не сразу понятна, согласился. Но за счет того, что текст сосредоточен в боковых панелях, он еще и не ""отсвечивает"" во время работы )",negative
"первые два ответа поставили в тупик, не понятно, почему так даже после обдумывания",negative
"""Придумайте пять адресов в вашем городе""С тем количеством плагинов, которые прямо в макет подставляют реальные адреса, это задание выглядит морально устаревшим",negative
"Давайте, если нужно придумать 5 вариантов, то сделаем для каждого варианта свой инпут) Очень не удобно в 1 ячейку писать",negative
"Пять услуг для этих сервисов - что имеется в виду? Услуги, которые оказывают эти сервисы (5) или 5 описаний услуг, оказываемых этими сервисами? На иллюстрации показана поисковая выдача по запросу. В яндексе, например, выдаются исполнители с похожими описаниями своих услуг. И как раз присутствует 3 строки подряд (из 5) с одним и тем же текстом.",negative
"кажется, у вас блоки поехали.",negative
"Не согласна, что блок 3 и 5 надо подтягивать из таблицы для каждой породы.3 — данные да, подтягивать, а отображение править на макете (а мы же об  этом с вами говорим тут). Пересчитывать 7 или 9 звездочек невозможно.5 — если весь это массив заливать текстом из описания породы, не получится сделать теги, как на скрине, потому что в каждом описании текстом будет написано что попало. Все эти поля должны быть сначала стандартно один раз отредактированы, а потом только получать галки выбор в значении полей.",negative
Что-то с нумерацией в блоках и вариантах ответов.,negative
"Заголовок я бы тоже меняла в макете. Если он длиннее одной строки, нужно показать разработчикам, переносится ли текст на вторую строку и каким образом.",negative
"Сложно было понять задание. Для реалистичности макета, на мой взгляд, важны блок 5 и блок 1",negative
"Не согласна про Блок №2, так как проще подгружать данные о сумме оставшихся книг из таблицы, чем править это значение вручную.",negative
"Не совсем поняла. Зачем редактировать в макете текст, который будет одинаковым для всех книг.",negative
"В блоке 2 выбираю оба варианта, потому что информация о количестве книг может подтягиваться из таблицы",negative
"*Если новый, то без отзывов.**Нижний абзац с иконкой — не понял зачем.",negative
"Мне кажется, некорректно считать Константинопольского неправильным ответом. Это не рыбная заглушка, а длинный вариант реального имени. Вообще не вижу, чем Алина лучше Константина. Вы же не говорите о том, что надо брать реальную ученицу и обязательно именно ее данные записывать.",negative
"Не поняла, что не так с дом 3, кв. 33. Цифры совпадают, в этом дело?",negative
"Не понял смысл этого задания, но как-то ответил всё правильно.",negative
"К сожалению, вообще не поняла это задание. Что надо сделать - очень пространно и нечетко сформулированно. И даже когда подбором нашла правильные ответы, так и не поняла почему Кирилл - ошибка, а Алина -нет. И с адресом тоже.",negative
"Не вполне ясно чем Кирилл Захаров хуже Алины.Аналогично, про адрес. Я в Питере не был ни разу; Дворцовая - это какое-то какое-то небывалое место?Ну и собственно формулировка задачи. ""Поменяйте тексты в макете"" - лаконично, но какова задача?""Чтобы было жизненно"" - ннне?!",negative
"Догадываюсь, что во втором пункте у вас вариант ""Ошибка"", но, во первых, у меня она не выбирается (мобильный андроид), а во-вторых, все вроде уже привыкли к ""что-то пошло не так"" и понимают это как то же сообщение об ошибке, мне кажется так тоже можно.",negative
"Слишком мало контекста. Хочется добавить свой вариант с той же ошибкой, где хорошо бы сразу писать в заголовке, что пошло не так, и дальше объяснять, как исправить\что можно сделать.",negative
"По второй картинке не соглашусь: в идеале нужно было бы написать причину ошибки человеческим языком, чтобы пользователь понимал, что происходит. Но в крайнем случае лучше оставить код ошибки на видном месте, то есть в заголовке. Чтобы при обращении в техподдержку пользователь мог быстро его сообщить.",negative
"Я читала, что номер ошибки пишется, чтобы можно было назвать его службе поддержки, тогда будет проще понять, что именно случилось. Наверное, ответ с ошибкой и номером тоже может быть правильным.",negative
"В последнем пункте без контекста сложно понять, что это за инструкция.",negative
"Не согласна с предпоследним вариантом. Не понятно, о получении чего идет речь. Соответственно, сложно говорить об отсутствии обмана.",negative
"Первый экран про копирайтера: если там всего две вакансии, то да, текст врёт. Но по картинке так не скажешь. Можно было бы добавить текст снизу (Всего 2 вакансии) или оставить больше свободного места. Сейчас кажется, что просто не все вакансии попали на экран.Или что-то не так с зарплатой? Там написана максимальная сумма, а в предложениях нет ни слова про деньги.",negative
"По первой картинке – прямого вранья нет,  но соглашусь, что есть манипуляция фактами. В любом случае указать медианную зарплату не помешало бы.По второй – все же приложение не знает всех моих планов на сегодня. Так что в контексте данных, которые ему доступно, оно честно с пользователем. Можно поменять формулировку на ""Вы пометили все задачи на сегодня как выполненные"".",negative
"В примере ""Защита платежа"" непонятен контекст. Можно понять как дополнительный платеж. Пример: страхование вклада в сбербанке. Рекламируют как защиту своих сбережений. Это предложение широко известно, его условия тоже. Пользователь может домыслить контекст сообщения на примере и неправильно понять название переключателя.",negative
"Я не поняла, почему «Ещё удобней. Все платежи собраны в один раздел» – это обман",negative
"Почему не подходит интерфейс ""Вы сделали все дела на сегодня""? Где здесь обман?",negative
Про корзину и уведомления не понял. Эти сообщения похожи на констатацию фактов.,negative
"интересно было бы почитать, для чего платежи собирают в один раздел. кажется, что это действительно удобнее",negative
А почему обманывает самый первый про 315 вакансий?,negative
"Про нас слышат не в первый раз. Нас точно знают, но могут не знать со стороны инвестиций и поэтому не доверять. Облажаться никак нельзя.",negative
"материал этого урока погрузил меня в глубокую депрессию (в обывательском смысле). насколько же сложно для заказчика я выражаюсь. насколько моё ""понятно"" отличается от их ""понятно"" и как же быть... как SAP объяснять ""на пальцах""?... нда.",positive
"Страховые агетны небрежно пролистывают? А если там мелким шрифтом что-то важное?)Признаться, не могу понять, зачем этим ребятам постоянно повторять важное)",negative
"Я исхожу из предположений, что мы даем им какую-то важную информацию (поэтому нельзя лажать), и они и так перегружены информацией, поэтому чтение — напряг, и надо быть проще. И повторять главную мысль, раз уж они такие перегруженные!",negative
"насчет четко сказать или повторять главную мысль непонятно. Это для всех такое правило, чтобы повторять мысль? Просто если реально занятые люди зачем их напрягать одно и то же повторяя?",negative
"Если им некогда разбираться с текстом и они читают только то, что зацепило, то почему их не напугать количеством букв и сложноподчинёнными предложениями? Мне кажется, тут противоречие.",negative
"Про первый пункт - я бы сказала, что это знакомая аудтория, но с которой не стоит экспериментировать",negative
"4 - группа и нужна для высказываний;5 - по возможности это надо пробовать ввсегда, но здесь - согласен с вами;6 - в данной ситуации используются правила группы;7 - расхождение с исходными условиями: у людей и так мелкого текста и законов выше крыши. Куда ещё?!",negative
"Тут тоже не согласна.  Этим ребятам ведь нужна работа, они не хотят судачить в курилке, им нужно руководство к действию? Или я уже не помню, как оно, быть выпускником))",negative
"Не соглашусь разве что с пищей для размышлений или действий. Сайт ярмарки ваканский для выпускников. Вряд ли они хотят обсуждать его, они хотят воспользоваться им как инструментом для получения профессии.",negative
